{
  "schema_version": "v1",
  "request_id": "schedule_request_01",
  "created_at": "2026-03-15T00:00:00Z",
  "zone_id": "America/New_York",
  "estimate_id": "estimate_synthetic_01",
  "tasks": [
    {
      "task_id": "task_flexible_01",
      "duration_minutes": 30,
      "earliest_at": "2026-03-15T21:20:00Z",
      "latest_at": "2026-03-16T11:40:00Z",
      "preference": "predicted_waking_window"
    },
    {
      "task_id": "task_flexible_02",
      "duration_minutes": 90,
      "earliest_at": "2026-03-15T20:50:00Z",
      "latest_at": "2026-03-15T21:20:00Z",
      "preference": "any_available"
    }
  ],
  "fixed_events": [
    {
      "event_id": "event_fixed_01",
      "start_at": "2026-03-15T22:50:00Z",
      "end_at": "2026-03-15T23:50:00Z"
    }
  ]
}
